{"schema_version":"unirouter.source-evidence.trust-set.v1","purpose":"source_evidence","domain":"unirouter.source-evidence.component.v1","keys":[{"signing_key_ref":"source-evidence-conformance-05","signer_public_key_id":"ed25519:sha256:a294e178d8c527e23c15fd2e7d5ff9627d29d0813745eeb35bb13250b704f8d6","algorithm":"ed25519","public_key":"3BiyhaIeZglqqTk/QI9LouC7K4c3F90PMwLHgc0iVp0="}]}